Ranking,Review
1,"A delightful, action-packed space adventure with a quirky cast, impressive visuals, and an awesome soundtrack."
2,"A visually stunning but divisive sci-fi film exploring the origin of humanity, filled with intriguing ideas."
3,"A psychological thriller with a captivating performance by James McAvoy, known for its thrilling twists."
4,"A fun animated movie featuring a group of animals competing in a singing competition, perfect for families."
5,"A superhero film showcasing a team of antiheroes, albeit criticized for uneven pacing but enjoyed by many."
6,"An action-fantasy film set in ancient China, known for its impressive visuals despite mixed critical reception."
7,"A modern musical masterpiece that intertwines romance, music, and ambition, captivating audiences worldwide."
8,"A British comedy with eccentric humor, following a washed-up actor involved in a real-life crime investigation."
9,"A captivating adventure drama based on a true story about exploration, ambition, and the Amazon rainforest."
10,"A sci-fi romance about two passengers waking up early on a spaceship, raising ethical dilemmas in their journey."
11,"A magical adventure set in the Harry Potter universe, exploring creatures and wizards in 1920s New York."
12,A remarkable true story showcasing the brilliance of African-American female mathematicians at NASA.
13,"A thrilling Star Wars standalone film with intense action, offering a fresh perspective within the saga."
14,"A visually stunning Disney animation celebrating Polynesian culture, known for its empowering story."
15,A unique blend of genres featuring a woman connected to a monster wreaking havoc in South Korea.
16,An entertaining animated comedy exploring the lives of pets when their owners are away.
17,A powerful war drama highlighting the courage and conviction of a conscientious objector.
18,"A fast-paced action thriller continuing the Bourne series, although criticized for a familiar plot and pacing issues."
19,"An emotionally powerful drama based on a true story, following a man's search for his family after being separated as a child."
20,"A thought-provoking sci-fi film that explores communication with extraterrestrial beings, praised for its intelligence."
21,"A tale of ambition and greed in the mining industry, led by a compelling performance from its lead actor, Matthew McConaughey."
22,"A poignant drama with outstanding performances, delving into grief, family, and human connections."
23,"A tense and chilling thriller focusing on a serial-killing couple's victims, praised for its unsettling atmosphere."
24,"An animated musical adventure filled with colorful visuals and catchy songs, ideal for family entertainment."
25,"A sequel to the popular sci-fi film, criticized for lacking the charm of its predecessor and its convoluted plot."
26,"A whimsical French comedy-drama showcasing an unconventional friendship, known for its quirky charm."
27,"An epic Indian film praised for its grandeur, visual effects, and compelling storytelling in a historical fantasy setting."
28,"A horror-thriller exploring sleep paralysis, but criticized for failing to fully capitalize on its intriguing concept."
29,"A comedy depicting the lives of overworked mothers who rebel against societal expectations, offering laughs and relatability."
30,"A video game adaptation blending action and fantasy elements, though criticized for a convoluted plot and lack of character depth."
31,"A comedy about a father's disapproval of his daughter's boyfriend, delivering humor but criticized for predictable jokes."
32,"A stylish and dark thriller featuring intertwined narratives, praised for its performances and striking visuals."
33,"A superhero film in the X-Men franchise, praised for its action but criticized for a lackluster plot and underdeveloped characters."
34,"A highly praised and successful R-rated superhero film known for its humor, action, and breaking the fourth wall."
35,"The final installment in the Resident Evil series, known for its action sequences but criticized for a convoluted plot."
36,"A superhero film with an ensemble cast, praised for its action and character dynamics, considered one of Marvel's best."
37,"A visually stunning sci-fi epic exploring space and time, known for its ambitious storytelling and breathtaking visuals."
38,"A Marvel superhero film introducing magic to the MCU, praised for its visual effects and Benedict Cumberbatch's performance."
39,"A remake of the classic Western, praised for its cast and action but criticized for lack of originality compared to the original."
40,"A coming-of-age film centered around a young man's fascination with filmmaking, celebrating the spirit of fandom."
41,"An R-rated animated comedy known for its raunchy humor and satirical take on animated films, targeting adult audiences."
42,"An Academy Award-winning drama exploring identity, sexuality, and life in a marginalized community, highly acclaimed."
43,"A low-budget horror film featuring a group of friends encountering terror in the woods, known for its explicit content."
44,"A biographical drama showcasing the origins of McDonald's and its controversial rise, praised for Michael Keaton's performance."
45,"A drama exploring family ties and the lowrider car culture, focusing on conflicts and aspirations within the community."
46,"An adventure film in the Pirates series, criticized for a lack of depth but praised for Johnny Depp's performance."
47,"A political thriller following a lobbyist, known for Jessica Chastain's performance but criticized for a formulaic plot."
48,"A fantasy film about fallen angels, based on a popular young adult novel series, but received mixed reviews for its execution."
49,"A sci-fi adventure with the crew of the USS Enterprise, praised for its action sequences and character dynamics."
50,"A drama exploring humanitarian aid in Africa, but criticized for its narrative execution despite strong performances."
51,"A thrilling return to the galaxy far, far away, blending nostalgia with new and exciting elements."
52,A dark and action-packed installment in the vampire vs. werewolf saga.
53,A star-studded ensemble cast in a heartwarming and comedic exploration of motherhood.
54,An exhilarating and stylish action film with Keanu Reeves delivering a memorable performance.
55,A groundbreaking superhero film with Heath Ledger's iconic portrayal of the Joker.
56,Martin Scorsese's epic and contemplative exploration of faith in 17th-century Japan.
57,A tense and well-executed thriller that keeps audiences on the edge of their seats.
58,A poignant and emotional romance with strong performances from Emilia Clarke and Sam Claflin.
59,A charming and well-crafted film about filmmaking during World War II.
60,Clint Eastwood directs a gripping and heroic true story of a miraculous plane landing.
61,"A visually impressive superhero clash, though divisive in its approach to iconic characters."
62,A chilling horror film with a clever premise and suspenseful storytelling.
63,A psychological thriller with an engaging plot and strong performances.
64,"An adaptation of the popular novel, criticized for its pacing and characterization."
65,Christopher Nolan's mind-bending and visually stunning exploration of rivalry and magic.
66,A stylish and action-packed spy film with a dose of humor and unexpected twists.
67,A gripping and respectful portrayal of the Boston Marathon bombing and its aftermath.
68,A high-octane and visually stunning post-apocalyptic action film that redefines the genre.
69,Bryan Cranston shines in this thought-provoking and unconventional exploration of identity.
70,A tense and well-executed disaster film based on the real-life oil rig explosion.
71,An epic historical drama set against the backdrop of the Armenian Genocide.
72,"A wartime romantic thriller with Brad Pitt and Marion Cotillard, though criticized for its pacing."
73,A visually stunning and emotionally resonant fantasy drama exploring grief and imagination.
74,"Despite a stellar cast, this film received mixed reviews for its unconventional narrative."
75,A clever and socially relevant animated film with humor and heart.
76,An ambitious and visually spectacular installment in the Pirates franchise.
77,A groundbreaking superhero ensemble film that laid the groundwork for the Marvel Cinematic Universe.
78,"Quentin Tarantino's alternate history war film, known for its sharp dialogue and intense scenes."
79,A swashbuckling and entertaining sequel that expands the Pirates saga.
80,"A reboot with a female-led cast, blending humor and supernatural elements."
81,Christopher Nolan's mind-bending heist film that challenges perceptions of reality.
82,A heartfelt and thought-provoking drama about a family living off the grid.
83,Martin Scorsese's exhilarating and controversial depiction of excess on Wall Street.
84,A gripping and suspenseful thriller with twists and turns that keep you guessing.
85,An action-packed and emotional installment in the Fast & Furious franchise.
86,A thrilling return to Jurassic Park with modern visuals and dinosaur spectacle.
87,Ben Affleck directs and stars in this stylish but uneven Prohibition-era crime drama.
88,James Cameron's groundbreaking and visually stunning epic set on the alien world of Pandora.
89,"Quentin Tarantino's Western with a unique blend of dialogue, violence, and tension."
90,A thriller with Ben Affleck as a high-functioning autistic accountant with a dangerous secret.
91,A dark and suspenseful crime drama exploring morality and justice.
92,"An ambitious adaptation of the video game, praised for its visuals but criticized for pacing."
93,"A compelling drama highlighting racial tensions in the 1960s South, based on the best-selling novel."
94,"A dark comedy based on a true story, exploring the absurdity of government contracts in war zones."
95,An action-packed sequel with the Avengers facing a formidable AI threat.
96,"A buddy comedy with Ryan Gosling and Russell Crowe, delivering humor and noir elements."
97,A beautifully animated Japanese film with a touching and fantastical love story.
98,"A horror film that pays homage to classic genre tropes, with a mix of supernatural elements."
99,"A psychological thriller starring Kristen Stewart, blending supernatural and psychological elements."
100,Martin Scorsese's gripping crime thriller with a stellar cast and intense storytelling.
101,Tom Hardy delivers a powerhouse dual performance in this gritty crime biopic.
102,A visually stunning and entertaining introduction to the Marvel Cinematic Universe.
103,"Ridley Scott's gripping and humorous survival story set on Mars, starring Matt Damon."
104,A Spanish thriller with intricate twists and turns that keep you guessing until the end.
105,"Stylish and action-packed, this spy film offers a delightful blend of humor and espionage."
106,"A modern Western with stellar performances, exploring themes of justice and family."
107,Robert De Niro shines in this character-driven comedy-drama about an aging stand-up comic.
108,"A visually impressive take on the classic character, offering a fresh perspective."
109,Katie Holmes directs and stars in this heartfelt drama about a mother-daughter relationship.
110,A thought-provoking sci-fi film that delves into the ethics of artificial intelligence.
111,A tense and brutal survival thriller set within an office building.
112,A powerful and Oscar-winning drama depicting the true story of Solomon Northup.
113,A dystopian love story with a unique and surreal narrative.
114,Zack Snyder's visually stunning and stylized retelling of the Battle of Thermopylae.
115,"The epic conclusion to the Harry Potter series, delivering on emotion and spectacle."
116,A raucous and comedic holiday film with a star-studded cast.
117,Nicolas Winding Refn's visually striking and controversial exploration of the fashion industry.
118,An inspiring sports drama based on the real-life story of wrestler Mahavir Singh Phogat.
119,A tense and claustrophobic thriller with unexpected twists.
120,A heartwarming and beautifully animated sequel to Finding Nemo.
121,Tim Burton brings his unique vision to this fantasy film based on the novel by Ransom Riggs.
122,"The first installment in the dystopian sci-fi series, introducing a world of factions."
123,A raunchy and comedic take on wedding-related chaos with Zac Efron and Adam DeVine.
124,The fourth installment in the action-packed martial arts franchise featuring Yuri Boyka.
125,"Christopher Nolan's epic conclusion to his Batman trilogy, with Christian Bale as the Caped Crusader."
126,A visually stunning live-action adaptation of Rudyard Kipling's classic tale.
127,"Michael Bay's action-packed spectacle with giant robots, explosions, and Mark Wahlberg."
128,A techno-thriller exploring the dangers of an online game with high stakes.
129,A musical romantic comedy featuring the hit songs of ABBA in a sun-soaked Greek setting.
130,"Alejandro G. Iñárritu's visually breathtaking survival epic, earning Leonardo DiCaprio an Oscar."
131,A powerful and emotionally charged drama adapted from August Wilson's Pulitzer Prize-winning play.
132,A star-studded adaptation of the beloved musical intertwining classic fairy tales.
133,Blake Lively stars in this tense survival thriller set in shark-infested waters.
134,An intense and gripping drama about a young drummer's pursuit of greatness.
135,The adrenaline-fueled sixth installment in the Fast & Furious franchise.
136,A multigenerational crime drama with a stellar cast and intricate storytelling.
137,"The Coen Brothers' masterful adaptation of Cormac McCarthy's novel, a dark and suspenseful tale."
138,Baz Luhrmann's visually stunning adaptation of F. Scott Fitzgerald's classic novel.
139,Martin Scorsese's psychological thriller with a mind-bending narrative and Leonardo DiCaprio.
140,A gritty and intense Western thriller exploring themes of revenge and survival.
141,"J.J. Abrams' reboot of the iconic sci-fi franchise, injecting new energy and excitement."
142,A lighthearted and comedic adaptation of the popular children's book series.
143,A satirical take on the 2008 financial crisis with a star-studded ensemble cast.
144,"A powerful and emotional drama, exploring the bond between a mother and her son in captivity."
145,Quentin Tarantino's bold and violent take on the spaghetti western genre.
146,Park Chan-wook's visually stunning and provocative South Korean psychological thriller.
147,A coming-of-age comedy-drama featuring Hailee Steinfeld's standout performance.
148,A visually striking and complex adaptation of Alan Moore's graphic novel.
149,A hilarious and relatable teen comedy that became a cult classic.
150,"The third film in the Robert Langdon series, combining mystery and action."
151,Steven Spielberg brings Roald Dahl's beloved children's book to life with magical charm.
152,"The first installment in the dystopian saga, introducing Katniss Everdeen and the Hunger Games."
153,A provocative and gritty drama exploring issues of race and privilege.
154,A tense and gripping thriller centered around the war on drugs at the U.S.-Mexico border.
155,A collection of deleted and extended scenes from David Lynch's iconic TV series.
156,A crossover sci-fi horror film bringing together two iconic extraterrestrial species.
157,Guillermo del Toro's visually stunning and action-packed homage to giant monster movies.
158,A charming romantic comedy with a stellar cast exploring the complexities of love.
159,"A visually inventive and comedic take on the graphic novel, blending music and video game elements."
160,"Edgar Wright's action-comedy masterpiece, combining humor and thrilling sequences."
161,A tense psychological thriller about survival and self-discovery in a desert setting.
162,A stylish and chaotic crime thriller with a unique premise and ensemble cast.
163,The X-Men unite across time in this thrilling installment with a strong cast.
164,Tom Cruise returns as Jack Reacher in this action-packed sequel.
165,"Daniel Craig's debut as James Bond, a gritty and action-packed reboot of the franchise."
166,"The start of the Twilight saga, introducing the love story between a vampire and a human."
167,"A sequel to the magical heist film, featuring the Four Horsemen in another high-stakes adventure."
168,A drama based on the true story of Maria Altmann's legal battle to reclaim a family painting.
169,Michael Bay directs this intense war film based on the Benghazi attack.
170,Daniel Craig returns as James Bond in this installment of the iconic spy series.
171,Jake Gyllenhaal delivers a riveting performance in this dark and suspenseful thriller.
172,A visually stunning stop-motion animated film with a heartfelt and magical story.
173,A horror film exploring the dangers of playing a mysterious VHS board game.
174,Spike Jonze's thought-provoking and emotional exploration of love and artificial intelligence.
175,"Disney's animated musical phenomenon, with memorable songs and a heartwarming story."
176,A visually ambitious adventure film exploring themes of innovation and imagination.
177,A compelling and emotionally charged continuation of the Apes franchise.
178,"A satirical action comedy with a stellar cast, lampooning Hollywood and war films."
179,A chilling horror sequel with Ed and Lorraine Warren facing another supernatural case.
180,A lighthearted and entertaining Marvel film featuring the superhero with the ability to shrink.
181,"The third installment in the Bridget Jones series, blending humor and romance."
182,"A chilling and atmospheric horror film set in 1630s New England, exploring themes of witchcraft."
183,"Disney's live-action adaptation of the classic fairy tale, bringing magic and romance to life."
184,A science fiction drama exploring the consequences of achieving immortality.
185,An Iranian drama that won the Academy Award for Best Foreign Language Film.
186,Gaspar Noé's provocative and explicit exploration of relationships and desire.
187,"Ang Lee's visually innovative war drama, exploring the impact of heroism on soldiers."
188,Guillermo del Toro's gothic romance with stunning visuals and a haunting atmosphere.
189,Nicolas Winding Refn's stylish and atmospheric crime drama featuring Ryan Gosling.
190,"Amy Schumer stars in this comedic take on modern romance, directed by Judd Apatow."
191,"A heartfelt drama about love and consequences, set against the backdrop of a lighthouse."
192,A Canadian erotic romantic drama exploring the passionate relationship between two women.
193,A riveting and Oscar-winning drama about the Boston Globe's investigation into clergy abuse.
194,A sci-fi thriller exploring the ethical implications of artificial intelligence.
195,An emotionally charged sports drama with powerful performances and intense fight scenes.
196,Chris Evans stars in this origin story of Captain America set during World War II.
197,"A thriller centered around cybercrime and hacking, with Keanu Reeves in the lead role."
198,"Sean Penn directs this adaptation of Jon Krakauer's nonfiction book, exploring the journey of Christopher McCandless."
199,Benedict Cumberbatch portrays Alan Turing in this compelling biographical drama.
200,Dwayne Johnson and Kevin Hart team up for a hilarious action-comedy with unexpected twists.
201,A thrilling sci-fi action film with Tom Cruise caught in a time loop against alien invaders.
202,A visually striking psychological horror film with a mysterious and unsettling atmosphere.
203,Joseph Gordon-Levitt portrays Edward Snowden in this gripping biographical thriller.
204,Robert Downey Jr. shines as Tony Stark in this kickoff to the Marvel Cinematic Universe.
205,The third installment in the Divergent series offers a mix of dystopian adventure and rebellion.
206,"A standout entry in the X-Men series, exploring the origins of the mutant superhero team."
207,A French-Belgian horror film that explores cannibalism in a coming-of-age context.
208,"A poetic and quietly observant film directed by Jim Jarmusch, starring Adam Driver."
209,A hilarious and heartwarming comedy about the challenges of being a bridesmaid.
210,"A unique take on the zombie genre, blending horror and drama with a strong cast."
211,Dwayne Johnson stars in this disaster film centered around a massive earthquake.
212,A provocative and visually stylized film about a group of college girls on spring break.
213,Michael Bay's action-packed blockbuster introduces the epic battle between Autobots and Decepticons.
214,"A South Korean thriller with a mind-bending plot and intense, visceral storytelling."
215,The God of Thunder returns in this Marvel sequel with cosmic battles and family drama.
216,"A visually ambitious fantasy film set in ancient Egypt, featuring gods and mythical creatures."
217,"A top-notch Marvel installment combining espionage, action, and superhero dynamics."
218,A family-friendly adventure where a teenager befriends a creature living in his truck.
219,"An atmospheric horror film that explores grief, guilt, and the supernatural."
220,A subversive and action-packed superhero film that challenges genre conventions.
221,A unique first-person action film that immerses the audience in a relentless thrill ride.
222,Pixar's animated film about sentient cars offers heartwarming storytelling and stunning visuals.
223,A critically acclaimed horror film with a fresh take on the genre and suspenseful storytelling.
224,David Fincher's adaptation of Stieg Larsson's mystery novel is a dark and gripping thriller.
225,"A comedy about a fake family on a road trip, featuring Jennifer Aniston and Jason Sudeikis."
226,A road trip drama with a compelling performance from Sasha Lane and a vivid exploration of youth culture.
227,A darkly humorous and thought-provoking film that satirizes societal expectations of relationships.
228,This sci-fi action film takes the Predator franchise to new heights with intense and suspenseful moments.
229,"A visually stunning reimagining of the Sleeping Beauty tale, focusing on the iconic villain Maleficent."
230,"A sci-fi thriller that delves into psychological horror, starring Noomi Rapace."
231,Guillermo del Toro's dark fantasy masterpiece that weaves a captivating and imaginative tale.
232,"A psychological thriller set in the 1960s, exploring the consequences of obsession and deception."
233,Mel Gibson directs this intense and visually striking adventure set in the final days of the Mayan civilization.
234,Tom Cruise returns as Ethan Hunt in this action-packed and thrilling installment of the franchise.
235,A fantasy adventure film that expands the world of Snow White and the Huntsman.
236,"A heartfelt coming-of-age film that addresses themes of friendship, love, and mental health."
237,Natalie Portman delivers an Oscar-winning performance in this biographical drama about Jacqueline Kennedy.
238,A psychological thriller centered around a haunted house and a dark secret.
239,Wes Anderson's visually delightful and whimsical comedy set in a fictional European hotel.
240,A South Korean monster film that combines elements of family drama and creature feature.
241,Brad Pitt leads a tank crew in this intense World War II film directed by David Ayer.
242,Pixar's emotionally resonant animated film explores the inner workings of the human mind.
243,An animated comedy-adventure about a Tibetan Mastiff pursuing his passion for music.
244,The Terminator franchise takes a new direction with a time-twisting plot and updated characters.
245,"A fantasy adventure based on Rick Riordan's novel, following the adventures of Percy Jackson."
246,"A musical adaptation of Victor Hugo's novel, featuring a stellar cast and powerful performances."
247,"A dystopian thriller with Alfonso Cuarón's masterful direction, exploring a world facing infertility."
248,A heartfelt and character-driven drama exploring the lives of three women in the late 1970s.
249,"Melissa McCarthy shines in this action-comedy, blending humor and espionage with a strong supporting cast."
250,A heartwarming and uplifting French film based on the true story of an unlikely friendship.
251,A French comedy-drama exploring themes of love and self-discovery.
252,Yorgos Lanthimos' provocative Greek film that challenges societal norms and family dynamics.
253,A biographical drama depicting the rise of the rap group N.W.A. in the 1980s.
254,Andrew Garfield reprises his role as Spider-Man in this sequel filled with superhero action.
255,A chilling horror film based on the real-life paranormal investigations of Ed and Lorraine Warren.
256,A wild and comedic journey through a bachelor party gone awry in Las Vegas.
257,"A sci-fi action film inspired by the classic board game, featuring naval warfare against alien invaders."
258,The rebooted Apes series begins with a gripping tale of intelligent apes and human conflicts.
259,"A horror film that explores the fear of darkness, with a supernatural entity terrorizing a family."
260,Richard Gere stars in this character-driven drama with political intrigue and moral dilemmas.
261,Alejandro González Iñárritu's visually inventive film that blurs the lines between reality and fiction.
262,A psychological thriller that delves into the intense and competitive world of ballet.
263,A satirical comedy-drama exploring racial tensions and identity on a college campus.
264,Lars von Trier's provocative exploration of a woman's sexual journey and experiences.
265,The beloved turtles return in this action-packed sequel with new allies and villains.
266,A psychological thriller that takes a dark turn when two young women invade a family's home.
267,A comedy featuring Robert De Niro and Zac Efron in a road trip filled with misadventures.
268,A visually ambitious and narratively complex film exploring interconnected stories across time.
269,Hugh Jackman's Wolverine gets an origin story in this entry into the X-Men film series.
